{
  "metadata": {
    "name": "toy sanity certificate",
    "spin": "1/2",
    "sobolev_index": 12,
    "weight": "price-law-local-energy-v1",
    "frequency_decomposition": "ns-sr-v1",
    "symbol_class": "toy-classical-S1"
  },
  "energy_positivity": [
    {
      "sector": "redshift",
      "chart": "near_horizon",
      "gram_identity": "G_redshift = S^*S + R",
      "lower_bound": "[1/8, 1/4]",
      "remainder_absorption": "[0, 1/64]"
    },
    {
      "sector": "exterior",
      "chart": "timelike_exterior",
      "gram_identity": "G_ext = S^*S + R",
      "lower_bound": "[1/10, 1/5]",
      "remainder_absorption": "[0, 1/80]"
    },
    {
      "sector": "ergoregion_hidden_symmetry",
      "chart": "ergoregion",
      "gram_identity": "G_ergo = S^*S + R",
      "lower_bound": "[1/16, 1/8]",
      "remainder_absorption": "[0, 1/128]"
    }
  ],
  "morawetz_positivity": [
    {
      "channel": "nonsuperradiant",
      "chart": "radial_bulk",
      "square_decomposition": "b_ns = sum |B_l|^2 + absorbable_errors",
      "bulk_lower_bound": "[1/32, 1/16]",
      "all_remainders_absorbable": true
    }
  ],
  "trapped_superradiant": {
    "torus_charts": [
      {
        "chart": "toy_trapped_torus",
        "fourier_polynomial": "P(theta)=1/4+(1/32)cos(theta)",
        "approximation_error": "[0, 1/128]",
        "resonant_average_lower_bound": "[1/16, 1/8]"
      }
    ],
    "symbol_globalization": {
      "escape_function": "g_sr_toy",
      "symbol_class": "toy-classical-S1",
      "fixed_neighborhood_remainder": "[0, 1/256]",
      "all_remainders_absorbable": true
    }
  },
  "nonlinear_null_hierarchy": {
    "all_quadratic_terms_classified": true,
    "all_cubic_terms_classified": true,
    "source_decay_eta": "[1/20, 1/10]",
    "source_constant": "[1, 2]",
    "modulation_decay_eta": "[1/20, 1/10]",
    "modulation_constant": "[1, 2]"
  },
  "compatibility": {
    "sobolev_index": 12,
    "weight": "price-law-local-energy-v1",
    "frequency_decomposition": "ns-sr-v1",
    "symbol_class": "toy-classical-S1",
    "max_derivative_loss": 4,
    "available_derivative_buffer": 6
  }
}
